{
  "repo": "astrapi69/adaptive-learner-content-test",
  "generated": "2026-10-01T09:58:10Z",
  "schema_version": "1.0",
  "sets": [
    {
      "id": "graded-quiz-demo-from-de",
      "name": "Graded-Quiz Demo (Test)",
      "description": "Eine Lektion: Theorie plus fünf Aufgaben (multiple_choice, cloze select, cloze type) und ein benotetes Quiz über den Extension-Typ ext:al-graded-quiz.",
      "source_language": "de",
      "target_language": "de",
      "level": "a1",
      "domain": "knowledge",
      "lesson_count": 1,
      "card_count": 3,
      "tags": [
        "knowledge",
        "test",
        "graded-quiz",
        "extension"
      ],
      "visibility": "hidden",
      "review_status": "authored",
      "ai_validated": false,
      "trust_level": 1,
      "book": null,
      "updated_at": "2026-10-01T09:57:08Z"
    }
  ],
  "total_lessons": 1,
  "total_cards": 3
}
